{"$schema": "http://json-schema.org/draft-07/schema#", "title": "QA Report", "type": "object", "required": ["episode_id", "overall_score", "items", "prompt_version"], "properties": {"episode_id": {"type": "string"}, "overall_score": {"type": "number", "minimum": 0, "maximum": 50}, "items": {"type": "array", "items": {"type": "object", "required": ["category", "score", "notes"], "properties": {"category": {"type": "string"}, "score": {"type": "number", "minimum": 0, "maximum": 10}, "notes": {"type": "string"}, "corrected": {"type": "boolean"}}}}, "final_images": {"type": "array", "items": {"type": "string"}}, "prompt_version": {"type": "string"}}}
